idsurvey,question,idpost
1,"What is the best way to improve communication skills?",1
2,"How do you define success in your own life?",2
3,"What motivates you to wake up every morning?",3
4,"Do you believe in the power of positive thinking?",4
5,"How do you stay focused while working from home?",5
6,"What is the importance of financial literacy today?",6
7,"Why is physical fitness essential for mental health?",7
8,"How can one overcome the fear of failure?",8
9,"What are your thoughts on artificial intelligence?",9
10,"Do you believe that history repeats itself?",10
11,"What is your opinion on climate change policies?",11
12,"How can technology enhance educational systems?",12
13,"What does happiness mean to you personally?",13
14,"Do you prefer working alone or in a team?",14
15,"What are the key traits of a good leader?",15
16,"Why is it important to have hobbies?",16
17,"What role does art play in our society?",17
18,"How do you handle criticism constructively?",18
19,"Do you believe humans will live on Mars someday?",19
20,"What are the benefits of learning new languages?",20
21,"What are the best practices for time management?",21
22,"How can one maintain work-life balance effectively?",28
23,"What is the most significant book you have read?",23
24,"How can we protect endangered species?",24
25,"What strategies help in building self-confidence?",25
26,"Why is volunteering beneficial for personal growth?",26
27,"How do you approach solving complex problems?",27
28,"What are the impacts of social media on youth?",28
29,"Why is critical thinking important in decision-making?",29
30,"What is your perspective on renewable energy sources?",30
31,"How can we encourage creativity in schools?",31
32,"What inspires you to take on new challenges?",32
33,"How do cultural differences shape our perspectives?",33
34,"What are the benefits of practicing mindfulness?",34
35,"Why is collaboration vital in achieving common goals?",35